{
  "current_protocol": 1,
  "min_supported_protocol": 1,
  "instance_id": "11111111-1111-4111-8111-111111111111",
  "boot_id": "33333333-3333-4333-8333-333333333333",
  "accepted_through_sequence": 43,
  "server_received_at": "2026-07-24T17:00:31.125Z",
  "lease_expires_at": "2026-07-24T17:02:01.125Z"
}
